[
  {
    "id": "11111111-1111-4111-8111-111111111101",
    "name": "metric:price_midband",
    "type": "pricing",
    "description": "Mid-range price band for impulse SKUs; used in scoring and routing.",
    "metrics": [{ "key": "price", "band": "mid", "currency_hint": "USD" }],
    "virtues": [{ "k": "margin_headroom", "v": "medium" }],
    "limitations": [{ "k": "geo", "v": "check_shipping" }],
    "cost_unit": "credit",
    "cost_value": 0.05,
    "provider_id": null,
    "version": 1,
    "created_by": "bbbbbbbb-bbbb-4bbb-8bbb-bbbbbbbbb001",
    "created_at": "2026-04-07T12:00:00.000Z",
    "history": [{ "at": "2026-04-07T12:00:00.000Z", "by": "bbbbbbbb-bbbb-4bbb-8bbb-bbbbbbbbb001", "action": "seed", "version": 1 }],
    "extra": { "example": "price" }
  },
  {
    "id": "11111111-1111-4111-8111-111111111102",
    "name": "metric:discount_flash_30",
    "type": "promotion",
    "description": "Flash discount ~30% window; high conversion intent.",
    "metrics": [{ "key": "discount", "pct": 30, "window": "flash" }],
    "virtues": [{ "k": "urgency", "v": "high" }],
    "limitations": [{ "k": "stock", "v": "may_vary" }],
    "cost_unit": "credit",
    "cost_value": 0.02,
    "provider_id": null,
    "version": 1,
    "created_by": "bbbbbbbb-bbbb-4bbb-8bbb-bbbbbbbbb001",
    "created_at": "2026-04-07T12:00:00.000Z",
    "history": [{ "at": "2026-04-07T12:00:00.000Z", "by": "bbbbbbbb-bbbb-4bbb-8bbb-bbbbbbbbb001", "action": "seed", "version": 1 }],
    "extra": { "example": "discount" }
  },
  {
    "id": "11111111-1111-4111-8111-111111111103",
    "name": "video_realism_level:standard",
    "type": "video",
    "description": "Standard realism preset for short-form reels (balanced cost).",
    "metrics": [{ "key": "video_realism_level", "level": 3, "scale_max": 5 }],
    "virtues": [{ "k": "latency", "v": "low" }],
    "limitations": [{ "k": "fine_detail", "v": "moderate" }],
    "cost_unit": "credit",
    "cost_value": 2.5,
    "provider_id": "22222222-2222-4222-8222-222222222201",
    "version": 1,
    "created_by": "bbbbbbbb-bbbb-4bbb-8bbb-bbbbbbbbb001",
    "created_at": "2026-04-07T12:00:00.000Z",
    "history": [{ "at": "2026-04-07T12:00:00.000Z", "by": "bbbbbbbb-bbbb-4bbb-8bbb-bbbbbbbbb001", "action": "seed", "version": 1 }],
    "extra": { "example": "video_realism_level" }
  },
  {
    "id": "11111111-1111-4111-8111-111111111104",
    "name": "tts_voice_quality:studio",
    "type": "audio",
    "description": "Studio-grade TTS: stable timbre, low sibilance, broadcast-safe.",
    "metrics": [{ "key": "tts_voice_quality", "score": 0.92, "scale": "0-1" }],
    "virtues": [{ "k": "clarity", "v": "high" }],
    "limitations": [{ "k": "languages", "v": "limited_pack" }],
    "cost_unit": "credit",
    "cost_value": 0.8,
    "provider_id": "22222222-2222-4222-8222-222222222202",
    "version": 1,
    "created_by": "bbbbbbbb-bbbb-4bbb-8bbb-bbbbbbbbb001",
    "created_at": "2026-04-07T12:00:00.000Z",
    "history": [{ "at": "2026-04-07T12:00:00.000Z", "by": "bbbbbbbb-bbbb-4bbb-8bbb-bbbbbbbbb001", "action": "seed", "version": 1 }],
    "extra": { "example": "tts_voice_quality" }
  },
  {
    "id": "11111111-1111-4111-8111-111111111105",
    "name": "ingest:admitad_feed_v1",
    "type": "ingest",
    "description": "Admitad CSV template lineage for AliExpress product sync.",
    "metrics": [{ "key": "feed", "template": "78215" }],
    "virtues": [{ "k": "freshness", "v": "hourly" }],
    "limitations": [{ "k": "schema_drift", "v": "monitor" }],
    "cost_unit": "credit",
    "cost_value": 0,
    "provider_id": null,
    "version": 1,
    "created_by": "bbbbbbbb-bbbb-4bbb-8bbb-bbbbbbbbb001",
    "created_at": "2026-04-07T12:00:00.000Z",
    "history": [{ "at": "2026-04-07T12:00:00.000Z", "by": "bbbbbbbb-bbbb-4bbb-8bbb-bbbbbbbbb001", "action": "seed", "version": 1 }],
    "extra": {}
  }
]
